<?xml version="1.0"?>
<!DOCTYPE Report
[
<!ELEMENT Report (General ,(Doc|BPT)) >
<!ATTLIST Report ver CDATA #REQUIRED tmZone CDATA #REQUIRED>

<!ELEMENT General ( DocLocation ) >
<!ATTLIST General productName CDATA #REQUIRED productVer CDATA #REQUIRED os CDATA #REQUIRED host CDATA #REQUIRED qcserver CDATA #IMPLIED qcproject CDATA #IMPLIED SolManSolutionId CDATA #IMPLIED SolManProjectId CDATA #IMPLIED SolManTestPlanId CDATA #IMPLIED SolManTestPackageId CDATA #IMPLIED SolManUserInfoData CDATA #IMPLIED  >

<!ELEMENT BPT (DName,Res,DVer?,TSet?,TInst?,NodeArgs,AdditionalInfo*,Doc*) >
<!ATTLIST BPT rID ID #REQUIRED >

<!ELEMENT Doc (DName,ConfName?,Res,DVer?,TSet?,TInst?,RunType?,DT?,AdditionalInfo*,Step*,DIter*,Step*,Action*,Doc*,Summary?,TestMaintenanceSummary*,NodeArgs?) >
<!ATTLIST Doc rID ID #REQUIRED type (Test|BC|BPTWrapperTest|Flow|Group|Action) "Test" productName CDATA #REQUIRED BCIter CDATA #IMPLIED >

<!ELEMENT RunType ( #PCDATA )>
<!ATTLIST RunType fmStep (False|True) "False" batch (False|True) "False" upDesc (False|True) "False" upChk (False|True) "False" upAS (False|True) "False">

<!ELEMENT DName ( #PCDATA ) >

<!ELEMENT ConfName ( #PCDATA ) >

<!ELEMENT Res ( #PCDATA ) >

<!ELEMENT AdditionalInfo (AdditionalDataName,AdditionalDataValue ) >

<!ELEMENT AdditionalDataName ( #PCDATA ) >

<!ELEMENT AdditionalDataValue ( #PCDATA ) >

<!ELEMENT DVer ( #PCDATA ) >

<!ELEMENT TSet ( #PCDATA ) >

<!ELEMENT TInst ( #PCDATA ) >

<!ELEMENT DIter (Step*,Action+,Summary?,NodeArgs)>
<!ATTLIST DIter rID ID #REQUIRED iterID CDATA #REQUIRED>

<!ELEMENT DocLocation ( #PCDATA )>

<!ELEMENT Action (AName,AIter*,(Step|HtmlStep|Action)*, Summary,ActionMaintenanceSummary*, NodeArgs ) >
<!ATTLIST Action rID ID #REQUIRED>

<!ELEMENT AIter ((Step|HtmlStep|Action)*,DataMapping?, Summary?,NodeArgs) >
<!ATTLIST AIter rID ID #REQUIRED iterID CDATA #REQUIRED isCountable (False|True) "False" >

<!ELEMENT AName ( #PCDATA ) >

<!ELEMENT TestMaintenanceSummary (ActionMaintenanceSummary*) >
<!ATTLIST TestMaintenanceSummary ObjectsAdded CDATA #REQUIRED ObjectsUpdated CDATA #REQUIRED StepsUpdated CDATA #REQUIRED StepsComments CDATA #REQUIRED><!ELEMENT ActionMaintenanceSummary (ObjectChange* ) >
<!ATTLIST ActionMaintenanceSummary Action CDATA #REQUIRED Objects CDATA #REQUIRED Updated CDATA #REQUIRED LinesTotal CDATA #REQUIRED Added CDATA #REQUIRED LinesUpdated CDATA #REQUIRED>

<!ELEMENT ObjectChange  (Hierarchy, PropertyChangeList* ) >
<!ATTLIST ObjectChange Operation CDATA #IMPLIED OriginalRepository CDATA #IMPLIED>

<!ELEMENT PropertyChangeList (PropertyDef*) >

<!ELEMENT PropertyDef (OriginalValue, NewValue) >
<!ATTLIST PropertyDef PropName CDATA #REQUIRED OriginRegularExpression (True|False) "False" NewRegularExpression (True|False) "False" AddedProperty (True|False) "False" >

<!ELEMENT OriginalValue ( #PCDATA )>

<!ELEMENT NewValue ( #PCDATA )>

<!ELEMENT Hierarchy  (ObjectName, Hierarchy*) >
<!ATTLIST Hierarchy MicClass CDATA #REQUIRED>

<!ELEMENT ObjectName  ( #PCDATA ) >

<!ELEMENT Step (Obj,Details,Time,TimeTick* ,(Step|HtmlStep|Doc)*, DataMapping?, NodeArgs) >
<!ATTLIST Step rID ID #REQUIRED retval CDATA #IMPLIED>

<!ELEMENT HtmlStep (HTML,TimeTick*,(Step|HtmlStep|Doc)*,NodeArgs) >
<!ATTLIST HtmlStep rID ID #REQUIRED >

<!ELEMENT Obj ( #PCDATA ) >
<!ATTLIST Obj plainTxt (False|True) "True">

<!ELEMENT Details ( #PCDATA ) >
<!ATTLIST Details plainTxt (False|True) "True">

<!ELEMENT Time ( #PCDATA ) >

<!ELEMENT HTML ( #PCDATA ) >

<!ELEMENT Disp ( #PCDATA ) >

<!ELEMENT TimeTick ( #PCDATA ) >

<!ELEMENT DataMapping ( DataMappedItem* )>
<!ELEMENT DataMappedItem EMPTY >
<!ATTLIST DataMappedItem dsName CDATA #REQUIRED >
<!ATTLIST DataMappedItem rowId CDATA #REQUIRED >

<!ELEMENT NodeArgs (Disp,TopPane?,BtmPane?,ExtendedInfo? )>
<!ATTLIST NodeArgs eType CDATA #REQUIRED icon CDATA #REQUIRED nRep CDATA #REQUIRED UserNote CDATA #IMPLIED filter (False|True) "True">
<!ATTLIST NodeArgs status (Passed|Failed|Done|Warning|Information) "Done">
<!ATTLIST NodeArgs iconSel CDATA #IMPLIED nType CDATA #IMPLIED MovieMarker CDATA "">
<!ATTLIST NodeArgs Source CDATA #IMPLIED SourceLine CDATA #IMPLIED StepFlowItemKey CDATA #IMPLIED >

<!ELEMENT TopPane (Path)>

<!ELEMENT BtmPane ( (Path|WR)?,ASHilite?)>
<!ATTLIST BtmPane vType CDATA "HTML">

<!ELEMENT Path ( #PCDATA ) >

<!ELEMENT ASHilite ( #PCDATA ) >

<!ELEMENT WR ( #PCDATA ) >

<!ELEMENT ExtendedInfo ( StepData ) >

<!ATTLIST ExtendedInfo StepType CDATA #REQUIRED>
<!ELEMENT DT (NodeArgs) >
<!ATTLIST DT rID ID #REQUIRED>

<!ELEMENT Summary (Param*)>
<!ATTLIST Summary sTime CDATA #IMPLIED eTime CDATA #IMPLIED passed CDATA #IMPLIED failed CDATA #IMPLIED warnings CDATA #IMPLIED retval CDATA #IMPLIED stopped (False|True) "False" >

<!ELEMENT Param (ParamName,ParamVal)+ >
<!ATTLIST Param paramInOut (In|Out) "In">

<!ELEMENT ParamName ( #PCDATA ) >

<!ELEMENT ParamVal ( #PCDATA ) >

]
>
<Report ver="2.0" tmZone="India Standard Time">
<General productName="HPE Unified Functional Testing" productVer="14.03" os="" host="LIN33005639"><DocLocation><![CDATA[C:\framework\QTP-Hybrid-Framework\QTP-Hybrid-Framework\TestCases\OrangeHybridFramework]]></DocLocation></General>
<Doc rID="T1"   productName= "HPE Unified Functional Testing"  >
<DName><![CDATA[OrangeHybridFramework]]></DName>
<Res><![CDATA[Res34]]></Res>
<DT rID="T2">
<NodeArgs eType="Table" icon="2" nRep="4" filter="False" >
<Disp><![CDATA[Run-Time Data Table]]></Disp>
<BtmPane vType="Table" >
<Path><![CDATA[Default.xls]]></Path>
</BtmPane>
</NodeArgs>
</DT>
<DIter rID="T3" iterID="1" >
<Action rID="T4">
<AName><![CDATA[login]]></AName>
<Step rID="T5">
<Obj plainTxt="False" ><![CDATA[[ username ].Set]]></Obj>
<Details plainTxt="False" ><![CDATA["Admin"]]></Details>
<Time><![CDATA[14-02-2023 - 15:26:23]]></Time>
<TimeTick>1676368583</TimeTick>
<NodeArgs eType="Replay" icon="5" nRep="10" >
<Disp><![CDATA[[ username ].Set]]></Disp>
</NodeArgs>
</Step>
<Step rID="T6">
<Obj plainTxt="False" ><![CDATA[[ password ].Set]]></Obj>
<Details plainTxt="False" ><![CDATA["63eb2bfa0109e1834d5ea387629418780ee4ae197a55"]]></Details>
<Time><![CDATA[14-02-2023 - 15:26:24]]></Time>
<TimeTick>1676368584</TimeTick>
<NodeArgs eType="Replay" icon="5" nRep="13" >
<Disp><![CDATA[[ password ].Set]]></Disp>
</NodeArgs>
</Step>
<Step rID="T7">
<Obj plainTxt="False" ><![CDATA[[  Login  ].Click]]></Obj>
<Details plainTxt="False" ><![CDATA[]]></Details>
<Time><![CDATA[14-02-2023 - 15:26:24]]></Time>
<TimeTick>1676368584</TimeTick>
<NodeArgs eType="Replay" icon="6" nRep="16" >
<Disp><![CDATA[[  Login  ].Click]]></Disp>
</NodeArgs>
</Step>
<Summary sTime="14-02-2023 - 15:26:23" eTime="14-02-2023 - 15:26:24" passed="0" failed="0" warnings="0" ></Summary>
<NodeArgs eType="StartAction" icon="4" nRep="7" >
<Disp><![CDATA[login Summary]]></Disp>
</NodeArgs>
</Action>
<Action rID="T8">
<AName><![CDATA[pim]]></AName>
<Step rID="T9">
<Obj plainTxt="False" ><![CDATA[[ PIM ].Click]]></Obj>
<Details plainTxt="False" ><![CDATA[]]></Details>
<Time><![CDATA[14-02-2023 - 15:26:25]]></Time>
<TimeTick>1676368585</TimeTick>
<NodeArgs eType="Replay" icon="7" nRep="21" >
<Disp><![CDATA[[ PIM ].Click]]></Disp>
</NodeArgs>
</Step>
<Step rID="T10">
<Obj plainTxt="False" ><![CDATA[[ Type for hints... ].Set]]></Obj>
<Details plainTxt="False" ><![CDATA["David"]]></Details>
<Time><![CDATA[14-02-2023 - 15:26:27]]></Time>
<TimeTick>1676368587</TimeTick>
<NodeArgs eType="Replay" icon="5" nRep="24" >
<Disp><![CDATA[[ Type for hints... ].Set]]></Disp>
</NodeArgs>
</Step>
<Step rID="T11">
<Obj plainTxt="False" ><![CDATA[[  Search  ].Click]]></Obj>
<Details plainTxt="False" ><![CDATA[]]></Details>
<Time><![CDATA[14-02-2023 - 15:26:27]]></Time>
<TimeTick>1676368587</TimeTick>
<NodeArgs eType="Replay" icon="6" nRep="27" >
<Disp><![CDATA[[  Search  ].Click]]></Disp>
</NodeArgs>
</Step>
<Step rID="T12">
<Obj plainTxt="False" ><![CDATA[[ Type for hints... ].Set]]></Obj>
<Details plainTxt="False" ><![CDATA["Chakri"]]></Details>
<Time><![CDATA[14-02-2023 - 15:26:27]]></Time>
<TimeTick>1676368587</TimeTick>
<NodeArgs eType="Replay" icon="5" nRep="30" >
<Disp><![CDATA[[ Type for hints... ].Set]]></Disp>
</NodeArgs>
</Step>
<Step rID="T13">
<Obj plainTxt="False" ><![CDATA[[  Search  ].Click]]></Obj>
<Details plainTxt="False" ><![CDATA[]]></Details>
<Time><![CDATA[14-02-2023 - 15:26:27]]></Time>
<TimeTick>1676368587</TimeTick>
<NodeArgs eType="Replay" icon="6" nRep="33" >
<Disp><![CDATA[[  Search  ].Click]]></Disp>
</NodeArgs>
</Step>
<Step rID="T14">
<Obj plainTxt="False" ><![CDATA[[  Add  ].Click]]></Obj>
<Details plainTxt="False" ><![CDATA[]]></Details>
<Time><![CDATA[14-02-2023 - 15:26:28]]></Time>
<TimeTick>1676368588</TimeTick>
<NodeArgs eType="Replay" icon="6" nRep="36" >
<Disp><![CDATA[[  Add  ].Click]]></Disp>
</NodeArgs>
</Step>
<Step rID="T15">
<Obj plainTxt="False" ><![CDATA[[ firstName ].Set]]></Obj>
<Details plainTxt="False" ><![CDATA["chakri"]]></Details>
<Time><![CDATA[14-02-2023 - 15:26:30]]></Time>
<TimeTick>1676368590</TimeTick>
<NodeArgs eType="Replay" icon="5" nRep="41" >
<Disp><![CDATA[[ firstName ].Set]]></Disp>
</NodeArgs>
</Step>
<Step rID="T16">
<Obj plainTxt="False" ><![CDATA[[ lastName ].Set]]></Obj>
<Details plainTxt="False" ><![CDATA["gopavaram"]]></Details>
<Time><![CDATA[14-02-2023 - 15:26:30]]></Time>
<TimeTick>1676368590</TimeTick>
<NodeArgs eType="Replay" icon="5" nRep="44" >
<Disp><![CDATA[[ lastName ].Set]]></Disp>
</NodeArgs>
</Step>
<Step rID="T17">
<Obj plainTxt="False" ><![CDATA[[ WebEdit ].Set]]></Obj>
<Details plainTxt="False" ><![CDATA["1176"]]></Details>
<Time><![CDATA[14-02-2023 - 15:26:30]]></Time>
<TimeTick>1676368590</TimeTick>
<NodeArgs eType="Replay" icon="5" nRep="47" >
<Disp><![CDATA[[ WebEdit ].Set]]></Disp>
</NodeArgs>
</Step>
<Step rID="T18">
<Obj plainTxt="False" ><![CDATA[[  Save  ].Click]]></Obj>
<Details plainTxt="False" ><![CDATA[]]></Details>
<Time><![CDATA[14-02-2023 - 15:26:30]]></Time>
<TimeTick>1676368590</TimeTick>
<NodeArgs eType="Replay" icon="6" nRep="50" >
<Disp><![CDATA[[  Save  ].Click]]></Disp>
</NodeArgs>
</Step>
<Step rID="T19">
<Obj plainTxt="False" ><![CDATA[[  Save  ].Click]]></Obj>
<Details plainTxt="False" ><![CDATA[]]></Details>
<Time><![CDATA[14-02-2023 - 15:26:36]]></Time>
<TimeTick>1676368596</TimeTick>
<NodeArgs eType="Replay" icon="6" nRep="63" >
<Disp><![CDATA[[  Save  ].Click]]></Disp>
</NodeArgs>
</Step>
<Step rID="T20">
<Obj plainTxt="False" ><![CDATA[[  Save  ].Click]]></Obj>
<Details plainTxt="False" ><![CDATA[]]></Details>
<Time><![CDATA[14-02-2023 - 15:26:36]]></Time>
<TimeTick>1676368596</TimeTick>
<NodeArgs eType="Replay" icon="6" nRep="66" >
<Disp><![CDATA[[  Save  ].Click]]></Disp>
</NodeArgs>
</Step>
<Step rID="T21">
<Obj plainTxt="False" ><![CDATA[[ PIM ].Click]]></Obj>
<Details plainTxt="False" ><![CDATA[]]></Details>
<Time><![CDATA[14-02-2023 - 15:26:36]]></Time>
<TimeTick>1676368596</TimeTick>
<NodeArgs eType="Replay" icon="7" nRep="69" >
<Disp><![CDATA[[ PIM ].Click]]></Disp>
</NodeArgs>
</Step>
<Step rID="T22">
<Obj plainTxt="False" ><![CDATA[[ Type for hints... ].Set]]></Obj>
<Details plainTxt="False" ><![CDATA["chakri"]]></Details>
<Time><![CDATA[14-02-2023 - 15:26:38]]></Time>
<TimeTick>1676368598</TimeTick>
<NodeArgs eType="Replay" icon="5" nRep="72" >
<Disp><![CDATA[[ Type for hints... ].Set]]></Disp>
</NodeArgs>
</Step>
<Step rID="T23">
<Obj plainTxt="False" ><![CDATA[[  Search  ].Click]]></Obj>
<Details plainTxt="False" ><![CDATA[]]></Details>
<Time><![CDATA[14-02-2023 - 15:26:38]]></Time>
<TimeTick>1676368598</TimeTick>
<NodeArgs eType="Replay" icon="6" nRep="75" >
<Disp><![CDATA[[  Search  ].Click]]></Disp>
</NodeArgs>
</Step>
<Step rID="T24">
<Obj plainTxt="False" ><![CDATA[[ WebCheckBox ].Set]]></Obj>
<Details plainTxt="False" ><![CDATA["ON"]]></Details>
<Time><![CDATA[14-02-2023 - 15:26:39]]></Time>
<TimeTick>1676368599</TimeTick>
<NodeArgs eType="Replay" icon="8" nRep="80" >
<Disp><![CDATA[[ WebCheckBox ].Set]]></Disp>
</NodeArgs>
</Step>
<Summary sTime="14-02-2023 - 15:26:24" eTime="14-02-2023 - 15:26:39" passed="0" failed="0" warnings="0" ></Summary>
<NodeArgs eType="StartAction" icon="4" nRep="18" >
<Disp><![CDATA[pim Summary]]></Disp>
</NodeArgs>
</Action>
<Action rID="T25">
<AName><![CDATA[myinfo]]></AName>
<Step rID="T26">
<Obj plainTxt="False" ><![CDATA[OrangeHRM]]></Obj>
<Details plainTxt="False" ><![CDATA[<table><tr><td><span style="text-align : left; font-size : 12px; ">Local Browser</span></td></tr></table>]]></Details>
<Time><![CDATA[14-02-2023 - 15:26:40]]></Time>
<TimeTick>1676368600</TimeTick>
<Step rID="T27">
<Obj plainTxt="False" ><![CDATA["OrangeHRM"- Smart Identification]]></Obj>
<Details plainTxt="False" ><![CDATA[<P><span class="text">The smart identification mechanism was invoked.</span></P><P><SPAN class=text>Reason: object not unique (2 objects found)</SPAN></P>           <SPAN class=text><b>Original description:</b></SPAN><br>micclass=Browser<br><P><FONT face=Verdana size=2><SPAN class=text><B>Smart Identification Alternative Description: </B></SPAN></FONT></P><FONT face=Verdana size=2><u>Base filter properties (2 objects found)&nbsp;</FONT></u><br>
micclass=Browser<br><br><FONT face=Verdana size=2><u>Optional filter properties</FONT></u><br>
name=OrangeHRM<SPAN class=passed> (Used</SPAN>, 1 matches)</SPAN><br>title=OrangeHRM<SPAN class=warning> (Ignored)<FONT color=#000000></FONT></SPAN><br>openurl=https://opensource-demo.orangehrmlive.com/web/index.php/auth/login<SPAN class=warning> (Ignored)<FONT color=#000000></FONT></SPAN><br>opentitle=OrangeHRM<SPAN class=warning> (Ignored)<FONT color=#000000></FONT></SPAN><br>openedbytestingtool=-1<SPAN class=warning> (Ignored)<FONT color=#000000></FONT></SPAN><br>number of tabs=1<SPAN class=warning> (Ignored)<FONT color=#000000></FONT></SPAN><br>]]></Details>
<Time><![CDATA[14-02-2023 - 15:26:40]]></Time>
<TimeTick>1676368600</TimeTick>
<NodeArgs eType="Replay" icon="10" nRep="85" >
<Disp><![CDATA["OrangeHRM"- Smart Identification]]></Disp>
</NodeArgs>
</Step>
<Step rID="T28">
<Obj plainTxt="False" ><![CDATA[OrangeHRM]]></Obj>
<Details plainTxt="False" ><![CDATA[Page]]></Details>
<Time><![CDATA[14-02-2023 - 15:26:40]]></Time>
<TimeTick>1676368600</TimeTick>
<Step rID="T29">
<Obj plainTxt="False" ><![CDATA[My Info.Click]]></Obj>
<Details plainTxt="False" ><![CDATA[]]></Details>
<Time><![CDATA[14-02-2023 - 15:26:40]]></Time>
<TimeTick>1676368600</TimeTick>
<NodeArgs eType="Replay" icon="7" nRep="88" >
<Disp><![CDATA[My Info.Click]]></Disp>
</NodeArgs>
</Step>
<NodeArgs eType="Context" icon="11" nRep="87" >
<Disp><![CDATA[OrangeHRM]]></Disp>
</NodeArgs>
</Step>
<Step rID="T30">
<Obj plainTxt="False" ><![CDATA[OrangeHRM_2]]></Obj>
<Details plainTxt="False" ><![CDATA[Page]]></Details>
<Time><![CDATA[14-02-2023 - 15:26:42]]></Time>
<TimeTick>1676368602</TimeTick>
<Step rID="T31">
<Obj plainTxt="False" ><![CDATA[Save.Click]]></Obj>
<Details plainTxt="False" ><![CDATA[]]></Details>
<Time><![CDATA[14-02-2023 - 15:26:42]]></Time>
<TimeTick>1676368602</TimeTick>
<NodeArgs eType="Replay" icon="6" nRep="93" >
<Disp><![CDATA[Save.Click]]></Disp>
</NodeArgs>
</Step>
<Step rID="T32">
<Obj plainTxt="False" ><![CDATA[Save_2.Click]]></Obj>
<Details plainTxt="False" ><![CDATA[]]></Details>
<Time><![CDATA[14-02-2023 - 15:26:42]]></Time>
<TimeTick>1676368602</TimeTick>
<NodeArgs eType="Replay" icon="6" nRep="96" >
<Disp><![CDATA[Save_2.Click]]></Disp>
</NodeArgs>
</Step>
<Step rID="T33">
<Obj plainTxt="False" ><![CDATA["vishal Bhattaraimohan"- Description mismatch]]></Obj>
<Details plainTxt="False" ><![CDATA[The object was not found using the test object description. Check the object's properties.]]></Details>
<Time><![CDATA[14-02-2023 - 15:27:00]]></Time>
<TimeTick>1676368620</TimeTick>
<NodeArgs eType="Replay" icon="12" nRep="133" status="Warning" >
<Disp><![CDATA["vishal Bhattaraimohan"- Description mismatch]]></Disp>
</NodeArgs>
</Step>
<Step rID="T34">
<Obj plainTxt="False" ><![CDATA["vishal Bhattaraimohan"- Smart Identification]]></Obj>
<Details plainTxt="False" ><![CDATA[<P><span class="text">The smart identification mechanism was invoked.</span></P><P><SPAN class=text>Reason: object not found.</SPAN></P>           <SPAN class=text><b>Original description:</b></SPAN><br>micclass=WebElement<br>innertext=vishal Bhattaraimohan<br>html tag=P<br><P><FONT face=Verdana size=2><SPAN class=text><B>Smart Identification Alternative Description: </B></SPAN></FONT></P><FONT face=Verdana size=2><u>Base filter properties (4 objects found)&nbsp;</FONT></u><br>
micclass=WebElement<br>html tag=P<br><br><FONT face=Verdana size=2><u>Optional filter properties</FONT></u><br>
html id=<SPAN class=passed> (Used</SPAN>, 4 matches)</SPAN><br>class=oxd-userdropdown-name<SPAN class=passed> (Used</SPAN>, 1 matches)</SPAN><br>innertext=vishal Bhattaraimohan<SPAN class=warning> (Ignored)<FONT color=#000000></FONT></SPAN><br>visible=-1<SPAN class=warning> (Ignored)<FONT color=#000000></FONT></SPAN><br>acc_name=<SPAN class=warning> (Ignored)<FONT color=#000000></FONT></SPAN><br>]]></Details>
<Time><![CDATA[14-02-2023 - 15:27:00]]></Time>
<TimeTick>1676368620</TimeTick>
<NodeArgs eType="Replay" icon="10" nRep="134" >
<Disp><![CDATA["vishal Bhattaraimohan"- Smart Identification]]></Disp>
</NodeArgs>
</Step>
<Step rID="T35">
<Obj plainTxt="False" ><![CDATA[vishal Bhattaraimohan.Click]]></Obj>
<Details plainTxt="False" ><![CDATA[]]></Details>
<Time><![CDATA[14-02-2023 - 15:27:00]]></Time>
<TimeTick>1676368620</TimeTick>
<NodeArgs eType="Replay" icon="12" nRep="135" >
<Disp><![CDATA[vishal Bhattaraimohan.Click]]></Disp>
</NodeArgs>
</Step>
<Step rID="T36">
<Obj plainTxt="False" ><![CDATA[Stop Run]]></Obj>
<Details plainTxt="False" ><![CDATA[Run stopped by user.]]></Details>
<Time><![CDATA[14-02-2023 - 15:27:00]]></Time>
<TimeTick>1676368620</TimeTick>
<NodeArgs eType="General" icon="13" nRep="136" status="Information" >
<Disp><![CDATA[Stop Run]]></Disp>
</NodeArgs>
</Step>
<NodeArgs eType="Context" icon="11" nRep="92" status="Warning" >
<Disp><![CDATA[OrangeHRM_2]]></Disp>
</NodeArgs>
</Step>
<NodeArgs eType="Context" icon="9" nRep="84" status="Warning" >
<Disp><![CDATA[OrangeHRM]]></Disp>
</NodeArgs>
</Step>
<Summary sTime="14-02-2023 - 15:26:40" eTime="14-02-2023 - 15:27:00" passed="0" failed="0" warnings="1" ></Summary>
<NodeArgs eType="StartAction" icon="4" nRep="82" status="Warning" >
<Disp><![CDATA[myinfo Summary]]></Disp>
</NodeArgs>
</Action>
<NodeArgs eType="StartIteration" icon="3" nRep="6" status="Warning" >
<Disp><![CDATA[OrangeHybridFramework Iteration 1 (Row 1)]]></Disp>
</NodeArgs>
</DIter>
<Summary sTime="14-02-2023 - 15:26:20" eTime="14-02-2023 - 15:27:00" passed="0" failed="0" warnings="1" stopped="True" ></Summary>
<NodeArgs eType="StartTest" icon="1" nRep="3" status="Warning" >
<Disp><![CDATA[Test OrangeHybridFramework Summary]]></Disp>
</NodeArgs>
</Doc>
</Report>